competitor_product_id,competitor,matched_ibuyflowers,matched_variety
8448957,Achillea Ptarmica Pearl White,Matricaria White,e8e5ba5b-a4e8-4531-85aa-83df24074212
490587,Agapanthus Blue,Agapanthus Blue Dark,cef57bc3-3538-4ed8-a971-b1482cb8c134
483748,Alstroemeria Assorted Select,Alstroemeria Assorted Mixed,c93bbc06-a172-494d-b352-4ad50f082de1
490071,Alstroemeria Assorted Super Select,Null,Null
941010,Alstroemeria Dirty Dancing Cream Select,Null,Null
941011,Alstroemeria Dirty Dancing Cream Super Select,Null,Null
1032021,Alstroemeria Dubai Light Pink Select,Alstroemeria Dubai Pink,e421f204-3869-47bb-be9e-109a31422e3c
940750,Alstroemeria Fifi Light Pink Select,Null,Null
940751,Alstroemeria Fifi Light Pink Super Select,Null,Null
1050612,Alstroemeria Galaxy Lavender Select,Null,Null
1050613,Alstroemeria Galaxy Lavender Super Select,Null,Null
14631876,Alstroemeria Green Planet Green Select,Alstroemeria Green,2e52f64f-0e58-4ac8-bc8a-c7777d55acb2
483772,Alstroemeria Hot Pink Select,Alstroemeria Hot Pink,f3b59026-24b4-441c-acb9-fece0736e3b9
483771,Alstroemeria Hot Pink Super Select,Alstroemeria Hot Pink,f3b59026-24b4-441c-acb9-fece0736e3b9
483776,Alstroemeria Lavender Select,Alstroemeria Lavender,766d1c52-bd9e-433d-8ad2-568178b0db70
483775,Alstroemeria Lavender Super Select,Alstroemeria Lavender Super Select,Null
484034,Alstroemeria Nadya Red Select,Null,Null
484033,Alstroemeria Nadya Red Super Select,Null,Null
484058,Alstroemeria Orange Queen Orange Select,Alstroemeria Orange Queen,1b2ec8fb-dfa1-4f37-bce5-76139ece8e24
484057,Alstroemeria Orange Queen Orange Super Select,Alstroemeria Orange Queen,1b2ec8fb-dfa1-4f37-bce5-76139ece8e24
483784,Alstroemeria Orange Select,Alstroemeria Orange,62754179-a5fb-4c9e-a221-1879b7252418
483783,Alstroemeria Orange Super Select,Null,Null
483792,Alstroemeria Pink Select,Alstroemeria Pink Select,Null
483791,Alstroemeria Pink Super Select,Alstroemeria Pink Super Select,Null
1822883,Alstroemeria Pink/White Select,Null,Null
1822884,Alstroemeria Pink/White Super Select,Alstroemeria Bella Super White,83dc5f85-4df4-4d2d-b6ef-ec23925b2ec2
484070,Alstroemeria Primadonna Pink Select,Alstroemeria Pink Primadonna,28dd0db2-a9c8-40d4-8a08-b7665a4dc6c2
484069,Alstroemeria Primadonna Pink Super Select,Alstroemeria Pink Primadonna,28dd0db2-a9c8-40d4-8a08-b7665a4dc6c2
646524,Alstroemeria Shakira Green Select,Null,Null
484110,Alstroemeria Tampa Orange Select,Null,Null
645936,Alstroemeria Voyager Yellow Select,Null,Null
1052765,Alstroemeria Whistler White Select,Alstroemeria Whistler White,75f2ac45-c272-41fd-8e1a-170f163cc328
1052766,Alstroemeria Whistler White Super Select,Alstroemeria Whistler White,75f2ac45-c272-41fd-8e1a-170f163cc328
483808,Alstroemeria White Select,Alstroemeria White,e500d7b6-a2a1-4965-aabe-f5170b5f64ad
483807,Alstroemeria White Super Select,Alstroemeria White,e500d7b6-a2a1-4965-aabe-f5170b5f64ad
500277,Amaranthus Hanging Green,Amaranthus Green Hanging,a035bd55-23af-4c21-83b0-baef07669984
513360,Amaranthus Hanging Red,Amaranthus Hanging Pink Red,ac7dc5a8-e6bf-4940-85e2-81eeaeeb7722
1937431,Amaranthus Upright Bronze,Amaranthus Bronze Upright,02cddc93-7f3d-4b99-bd4e-f702a38dc3ae
513364,Amaranthus Upright Red,Amaranthus Burgundy Red Upright,fbeeb4c0-1e58-46ef-bdcc-25db333350f7
513365,Anemone Assorted,Anemone Assorted Mixed Seasonal,71736aec-be6d-4714-bf80-1bdbcca274ff
513375,Anemone Black Center White,Anemone White,7b6fb0c0-643a-436f-b712-cc5ee4ad2b8a
513367,Anemone Blue,Anemone Blue Purple,fb7b8740-e49b-4470-b4c5-f1eb4282b2dd
513366,Anemone Blush,Anemone Blush Mistral Plus White,33f2d0fc-0785-4be1-8e77-913eb1f797a2
12983878,Anemone Levante Blue,Anemone Levante Pale White,ffc0601b-7333-4cf5-aa46-9467eab62779
12983873,Anemone Levante Fuchsia,Anemone Levante Pink,2f1f64a4-32e7-44b8-a036-82c5d342b596
12983877,Anemone Levante Pink,Anemone Levante Pink,2f1f64a4-32e7-44b8-a036-82c5d342b596
12983905,Anemone Levante Red,Anemone Levante Red,af6f8eab-8e58-49d5-a47f-82fd8ea22cfc
12983858,Anemone Levante White,Anemone Levante Pale White,ffc0601b-7333-4cf5-aa46-9467eab62779
3912336,Anemone Mistral Bordeaux Burgundy,Anemone Bordeaux Mistral Plus Purple,9ba9513c-137a-44d3-9848-cb68de5d66ce
3111261,Anemone Mistral Grape Purple,Anemone Mistral Purple Viola,9f8edd9a-5959-469a-a7c6-c504e29a4758
513373,Anemone Red,Anemone Red,f94664ba-fd1a-4c84-af02-92761b5d6451
514524,Aralia Leaves Green,Aralia Green Large,2dae1f7e-b5f8-4b5d-b63a-f555629cd0d1
514550,Aspidistra Green,Aspidistra Green,4bc3006d-c2c3-4f27-9725-9d5033c6568a
514550,Aspidistra Green,Aspidistra Green,4bc3006d-c2c3-4f27-9725-9d5033c6568a
514551,Aspidistra Variegated,Aspidistra Variegated,36b75d67-defd-4b5e-a3df-218a67d52d21
514551,Aspidistra Variegated,Aspidistra Variegated,36b75d67-defd-4b5e-a3df-218a67d52d21
939558,Aster Carnival Pink,Aster Carnival Pink Solidago Spray,83d94b82-4b30-4fad-8cb9-d52fa595744a
939556,Aster Carnival Purple,Aster Carnival Purple Solidago Spray,2771c449-e2af-4c96-a7aa-3ea9a26bbea2
939557,Aster Carnival White,Aster Carnival Duplo Spray White,c6d6a07e-a6c9-4ed3-9af0-edba8cf803b5
484140,Aster Matsumoto Assorted,Assorted Aster Matsumoto Mixed,6c8bd6ea-0373-48ca-a17c-315e1a16d141
484141,Aster Matsumoto Hot Pink,Aster Matsumoto Pink,767c14cc-0bf0-48c1-92ff-ce47d2e98a52
484141,Aster Matsumoto Hot Pink,Aster Matsumoto Pink,767c14cc-0bf0-48c1-92ff-ce47d2e98a52
484144,Aster Matsumoto Pink,Aster Matsumoto Pink,767c14cc-0bf0-48c1-92ff-ce47d2e98a52
484145,Aster Matsumoto Purple,Aster Blue Matsumoto Purple,22655a27-ee45-401b-b4c1-41a86d6d4c8b
484145,Aster Matsumoto Purple,Aster Blue Matsumoto Purple,22655a27-ee45-401b-b4c1-41a86d6d4c8b
484146,Aster Matsumoto Red,Aster Matsumoto Pink,767c14cc-0bf0-48c1-92ff-ce47d2e98a52
484146,Aster Matsumoto Red,Aster Matsumoto Pink,767c14cc-0bf0-48c1-92ff-ce47d2e98a52
484147,Aster Matsumoto White,Aster Matsumoto White,c38a132b-36e9-49db-ac66-d3f401dc8a9b
484147,Aster Matsumoto White,Aster Matsumoto White,c38a132b-36e9-49db-ac66-d3f401dc8a9b
484153,Aster Montecasino White,Null,Null
1540958,Aster Sungal Purple,Aster Purple Sungal,86be0e0b-0dd2-4916-8725-cc78e0141c6f
1540958,Aster Sungal Purple,Aster Purple Sungal,86be0e0b-0dd2-4916-8725-cc78e0141c6f
1540957,Aster Sunrio White,Aster Sunrio White,eca4c5d8-f42a-4c7b-a042-13857053a9c3
1051721,Astrantia Burgundy,Astrantia Burgundy,64c28247-d0d7-48de-b89d-9977f6cb5a80
514557,Astrantia Light Pink,Astrantia Light Pink,2866cb45-f725-4a0a-bd05-bd142052a02a
1053054,Astrantia Pink,Astrantia Pink,592d1f9d-d7a5-44c8-a2dd-31e033e6d644
514560,Astrantia White,Astrantia White,b86d08b2-d95f-446b-ae1e-b8300ffe0059
514564,Atriplex Green,Null,Null
666513,Bells of Ireland Green Long,Bells Green Ireland Molucella Of,7a807e5f-c371-4970-ba7c-0382161d9a1e
666512,Bells of Ireland Green Medium,Bells Green Ireland Molucella Of,7a807e5f-c371-4970-ba7c-0382161d9a1e
1006583,Bells of Ireland Green Xlong,Bells Green Ireland Molucella Of,7a807e5f-c371-4970-ba7c-0382161d9a1e
514596,Berzelia Baubles Green,Null,Null
514596,Berzelia Baubles Green,Null,Null
500207,Bird of Paradise Orange Select,Birds Of Orange Paradise Strelitzia,441361b3-347d-4e8e-bddd-a49a188c45ad
484171,Bromeliad Red,Null,Null
513531,Brunia Albiflora Green,Null,Null
513531,Brunia Albiflora Green,Null,Null
513533,Brunia Spray Silver,Null,Null
513533,Brunia Spray Silver,Null,Null
490599,Bupleurum Green,Bupleurum Green,f4e7a51e-5255-40b1-a8b6-aca0acf488a8
490599,Bupleurum Green,Bupleurum Green,f4e7a51e-5255-40b1-a8b6-aca0acf488a8
484178,Calla Lily Mini Assorted,Assorted Calla Mini Mixed,cf6bb0ff-f433-4341-833a-e0d50faa64bf
484179,Calla Lily Mini Assorted,Assorted Calla Mini Mixed,cf6bb0ff-f433-4341-833a-e0d50faa64bf
484192,Calla Lily Mini Burgundy,Burgundy Calla Mini,c97b9f96-1e84-4d4e-b706-b025a80ea4c8
484193,Calla Lily Mini Burgundy,Burgundy Calla Mini,c97b9f96-1e84-4d4e-b706-b025a80ea4c8
632859,Calla Lily Mini Elegant Swan Blush/White,Bridesmaid Calla Mini White,28f494a5-89f7-46ee-98c9-3e7a2e34a756
484419,Calla Lily Mini Garnet Glow Hot Pink,Null,Null
484207,Calla Lily Mini Hot Pink,Calla Mini Pink,579a70c9-95ed-495e-a213-1dfeb34cc7b5
484208,Calla Lily Mini Hot Pink,Calla Mini Pink,579a70c9-95ed-495e-a213-1dfeb34cc7b5
1092047,Calla Lily Mini Morning Sun Orange,Calla Mini Orange Orange/ Red,88e3dead-38f7-4d6f-8a5d-6b33b5baac70
484520,Calla Lily Mini Odessa Black,Black Calla Mini Odessa,c6cedc4e-0e7c-435f-81f1-1ea0da0bba57
484228,Calla Lily Mini Orange,Calla Mini Orange,265839c7-702b-4826-8c90-89de8866f262
484229,Calla Lily Mini Orange,Calla Mini Orange,265839c7-702b-4826-8c90-89de8866f262
1090142,Calla Lily Mini Paco Milka Lavender,Calla Mini Paco Purple,182072bd-c8f7-4d4c-8c27-f666ecdb0db8
484557,Calla Lily Mini Picasso Purple/White,Calla Mini Picasso Purple,6ab4e7dc-8828-40c3-b46f-2a9ca44f76e0
484558,Calla Lily Mini Picasso Purple/White,Calla Mini Picasso Purple,6ab4e7dc-8828-40c3-b46f-2a9ca44f76e0
484241,Calla Lily Mini Pink,Calla Mini Pink,579a70c9-95ed-495e-a213-1dfeb34cc7b5
1054883,Calla Lily Mini Pink Jewel Dark Pink,Calla Mini Pink,579a70c9-95ed-495e-a213-1dfeb34cc7b5
484653,Calla Lily Mini Schwarzwalder Black,Black Calla Mini Odessa,c6cedc4e-0e7c-435f-81f1-1ea0da0bba57
484671,Calla Lily Mini Sumatra Hot Pink,Null,Null
484255,Calla Lily Mini White,Calla Mini White,02b9ab64-ded4-4b63-8a73-8e9d60af005a
484256,Calla Lily Mini White,Calla Mini White,02b9ab64-ded4-4b63-8a73-8e9d60af005a
484257,Calla Lily Mini White,Calla Mini White,02b9ab64-ded4-4b63-8a73-8e9d60af005a
484262,Calla Lily Mini Yellow,Calla Mini Yellow,d3bee0a2-d5f6-4638-88c6-e7153f47c3bb
484263,Calla Lily Mini Yellow,Calla Mini Yellow,d3bee0a2-d5f6-4638-88c6-e7153f47c3bb
484264,Calla Lily Mini Yellow,Calla Mini Yellow,d3bee0a2-d5f6-4638-88c6-e7153f47c3bb
484681,Calla Lily Super White,Null,Null
490412,Campanula Pink,Campanula Pink,4dfcae7b-b869-4e53-b242-065f9e29b4b5
490413,Campanula Purple,Campanula Purple,ab43b132-ced7-4644-b458-756d0015cc76
490411,Campanula White,Campanula White,dec568b5-e939-43a6-9354-368a663f6430
514191,Carnation Bernard Dark Pink Select,Bernard Carnation Pink,a054ba76-b87e-44c5-b8b5-eb795af8898b
484790,Carnation Bizet Hot Pink Select,Bizet Carnation Pink,90e193ff-c642-4aa0-a679-a3f5120f42e4
823385,Carnation Brut Blush Select,Blush Brut Carnation,00277380-3ecc-45bc-875e-5fc3254c3534
484716,Carnation Burgundy Select,Burgundy Carnation Zurigo,6842cf5e-5e8b-47fa-9eaa-d31546c0b515
484720,Carnation Cream Select,Carnation Cream,0328d60c-8301-466a-8291-0772bc6e1ac6
484808,Carnation Creola Antique Pink Select,Carnation Creola Pink,a3f3fd29-8c4f-4da9-a946-def84de0fcaf
514214,Carnation Diletta Cream Cream Select,Null,Null
4586352,Carnation Dollar Dark Pink Select,Carnation Doncel Pink,abc65461-0901-44ac-bb67-15c814a06de8
514218,Carnation Doncel Blush Select,Carnation Doncel Pink,abc65461-0901-44ac-bb67-15c814a06de8
484828,Carnation Farida Lavender Select,Carnation Farida Lavender,9543b07a-1958-4fb1-b397-d2d95adbd3e8
514235,Carnation Golem Purple Select,Carnation Golem Purple,c880b3d4-f5e9-4f9f-9039-66d3e923d418
484728,Carnation Green Select,Carnation Green Select,Null
484732,Carnation Hot Pink Select,Carnation Hot Pink,e3a3412a-6db4-4f05-8139-78436cf8de20
644154,Carnation Ikebana Medium Pink Select,Null,Null
514262,Carnation Kaori Pink Select,Null,Null
484861,Carnation Komachi Pink/White Select,Carnation Komachi Pink,c12fdaaf-a7ad-4b88-9489-f6912edf061f
799475,Carnation Lege Marrone Beige Select,Carnation Lege Marrone Pink,17d100cb-9735-4ded-8147-c2ca48d20838
484867,Carnation Lege Pink Pink Select,Carnation Lege Pink,73412d93-71dd-4cbb-b3a8-f41f1094823c
484740,Carnation Light Pink Select,Carnation Light Pink,9f356a84-cfc6-4e69-921c-007dcfffba64
484876,Carnation Lizzy Peach Select,Carnation Lizzy Pink,4dbb3b94-eb53-459e-9c2a-7e1db70d1805
484935,Carnation Novelty Pack Assorted Select,Assorted Carnation Mixed Novelty,662d86f9-a874-4d93-9bf0-26021fe24294
514332,Carnation Novia Peach Select,Carnation Novia Peach,0db2a31e-87ca-4ac6-b067-4276beebd94a
514239,Carnation Orange Hermes Orange Select,Carnation Hermes Orange,4eeddf00-be01-4974-973f-252facd67594
484744,Carnation Orange Select,Carnation Orange,a1a3331a-c01c-4f0d-96b6-aafc9c1d6916
484748,Carnation Peach Select,Carnation Peach,7930d085-6b9d-4ed5-9ea4-30b0e9367ffd
484957,Carnation Peppermint Select,Carnation Peppermint,92b0e80d-9e76-44fd-9ddc-6d09c4d7d258
484752,Carnation Pink Select,Carnation Pink,099afe34-5d77-4e3d-ad1b-9de715fb92cd
484963,Carnation Polimnia Light Yellow Select,Null,Null
4586355,Carnation Premier Purple/White Select,Null,Null
484760,Carnation Red Select,Carnation Red,24b9d4a7-3e41-48a8-b10a-37af8341388a
1051168,Carnation Rodas Cream Select,Carnation Cream Rodas,7bc4524d-03a3-4686-a110-837f67016bc2
514358,Carnation Tiepolo Fuschia Lavender Select,Carnation Fuchsia Tiepole,4574ac3e-9513-44f6-91ca-97306a80300a
484768,Carnation White Select,Carnation White,091560ba-78a3-4c6c-b0f6-3729d9a26b38
484772,Carnation Yellow Select,Carnation Yellow,7d5112c6-516a-44b4-bcb6-e2e6331ca10f
513502,CB Rose Assorted,Null,Null
513503,CB Rose Assorted,Null,Null
513506,CB Rose Red,Null,Null
513507,CB Rose Red,Null,Null
1814392,CB Rose Red/Assorted,Null,Null
1814394,CB Rose Red/Assorted,Null,Null
3638498,CB Rose Assorted,Null,Null
3691397,CB Rose Assorted,Null,Null
3052188,CB Rose Assorted,Null,Null
3052189,CB Rose Assorted,Null,Null
3052190,CB Rose Red,Null,Null
3052202,CB Rose Red,Null,Null
3052177,CB Rose Red/Assorted,Null,Null
3052185,CB Rose Red/Assorted,Null,Null
2937184,CB Rose Assorted,Null,Null
3204730,CB Rose One Dozen Assorted,Null,Null
4177444,CB Rose Pink,Null,Null
3198437,CB Rose Two Dozen Assorted,Null,Null
4177446,CB Rose White,Coldplay Roses White,c9c39b04-16e0-4bff-a67e-183e2b97b1c1
1091764,Chrysanthemum Disbud Ball Green,Bombon Chrysanthemum Disbuds/ Fuzzball Green Mums,6ee34af1-93ec-4e35-aef9-5dd6ee986e25
3240253,Chrysanthemum Disbud Ball Gustav Purple,Null,Null
762586,Chrysanthemum Disbud Ball White,Chrysanthemum Disbuds/ Football Mums White,52e91d31-5f13-4ac0-bf00-aeb5f7edf7a0
762587,Chrysanthemum Disbud Ball Yellow,Null,Null
1999673,Chrysanthemum Disbud Candyfloss Light Pink,Null,Null
1999673,Chrysanthemum Disbud Candyfloss Light Pink,Null,Null
514812,Chrysanthemum Disbud Cooper Bronze,Bronze Chrysanthemum Cooper Cushion Pom Spray,c8a34395-210e-4d3a-8527-5e6961b371df
2025973,Chrysanthemum Disbud Creme Brulee Yellow,Null,Null
2100085,Chrysanthemum Disbud Dark Rossano Lavender,Chrysanthemum Cremon Dark Disbuds/ Lavender Mums Rosanno,9b6f1f21-804d-41ee-8427-c8264136eb43
1999674,Chrysanthemum Disbud Fairytale Pale Mauve,Chrysanthemum Cremon Disbuds/ Fairytale Mums Pink Pink/salmon,cc33d574-8491-4ff4-a5e5-770a59f836dc
3893429,Chrysanthemum Disbud Fantasia Pink/Peach,Null,Null
609314,Chrysanthemum Disbud Four Ladies Bronze,Null,Null
1736516,Chrysanthemum Disbud Fuego Brown,Bronze Chrysanthemum Cremon Disbuds/ Fuego Mums,18a0d9d5-3dde-4f62-9a28-20842d2e9512
1812281,Chrysanthemum Disbud Linette Peach,Chrysanthemum Cremon Disbuds/ Linette Mums Pink/salmon Salmon,02348a95-f983-41b0-b05f-70c3dcd46bf5
2166722,Chrysanthemum Disbud Mochi Vintage Pink,Null,Null
514808,Chrysanthemum Disbud Red,Null,Null
879899,Chrysanthemum Disbud Resourci Bronze,Bronze Chrysanthemum Disbuds/ Football Mums Resouci,c8447689-fe62-4345-a6ed-4ae229188bf9
1435609,Chrysanthemum Disbud Romancero Salmon,Null,Null
762592,Chrysanthemum Disbud Tornado Red,Null,Null
4333590,Chrysanthemum Disbud Veronica Salmon,Chrysanthemum Cushion Pom Salmon Spray Veronica,ec825c93-8c8a-4ec1-8bb3-ee32cf25e302
514836,Cocculus Green,Cocculus Green,38e27336-fc0a-4a08-b78f-bf8f7533511d
514843,Commodore Teepee Green,Null,Null
514843,Commodore Teepee Green,Null,Null
627846,Craspedia Billy Balls Yellow,Balls Billy Globosa Yellow,25f6db00-f356-41b8-8725-c1f493351e65
490520,Cremons Assorted,Assorted Chrysanthemum Cremon Disbuds/ Everyday Mixed Mums,3a04c553-00b8-4b3d-abda-d41bdd80406b
485024,Cremons Purple,Chrysanthemum Cremon Disbuds/ Mums Purple,a7642935-aa1f-473e-a268-6d2e51e41990
988313,Cremons Rossano Charlotte Pink/Green,Charlotte Chrysanthemum Cremon Disbuds/ Mums Pink Rosanne,18e1cf7f-d62d-4eb2-aa8a-986f0e6552e2
485025,Cremons White,Chrysanthemum Cremon Disbuds/ Mums White,45a378e6-4319-413f-9fa2-4dce02b62562
485026,Cremons Yellow,Chrysanthemum Cremon Disbuds/ Mums Yellow,83ddd51b-1f83-412c-a4c5-709983c59b40
515298,Dahlia Assorted,Assorted Dahlias Mixed,80eb364c-d311-44a0-822a-5ad415cd530e
515305,Dahlia Burgundy,Null,Null
515349,Dahlia Cafe Au Lait Cream,Au Cafe Cream Dahlias Lait,5171df9b-74ec-417b-b459-ff2277340a33
515315,Dahlia Orange,Ball Dahlias Orange Type,d18c762f-528b-4181-8b0a-c7294dc40c65
515317,Dahlia Pink,Null,Null
515319,Dahlia Red,Null,Null
515325,Dahlia White,Dahlias White,1e065665-ea54-4eae-b6fd-61caa4679e6b
513548,Delphinium Belladonna White,Belladonna Delphinium White,a2e58c8c-2e1f-4fe8-b479-75f1f008fbeb
726154,Delphinium Hybrid White,Delphinium Hybrid White,88f3b515-a55b-4f00-9c17-a84d774209d4
5562438,Delphinium Hybrid White,Delphinium Hybrid White,88f3b515-a55b-4f00-9c17-a84d774209d4
643952,Delphinium Sea Waltz Dark Blue,Blue Delphinium Sea Waltz,8e7c3944-669a-4f12-b579-21b9f6277502
643952,Delphinium Sea Waltz Dark Blue,Blue Delphinium Sea Waltz,8e7c3944-669a-4f12-b579-21b9f6277502
643954,Delphinium Sea Waltz Dark Blue,Blue Delphinium Sea Waltz,8e7c3944-669a-4f12-b579-21b9f6277502
490521,Delphinium Volkerfrieden Dark Blue,Blue Delphinium Volkerfrieden,de8df88b-9de8-4e0d-bbad-e058e412a9b8
636942,Delphinium Volkerfrieden Dark Blue,Blue Delphinium Volkerfrieden,de8df88b-9de8-4e0d-bbad-e058e412a9b8
635892,Delphinium Volkerfrieden Dark Blue,Blue Delphinium Volkerfrieden,de8df88b-9de8-4e0d-bbad-e058e412a9b8
643872,Delphinium Volkerfrieden Dark Blue,Blue Delphinium Volkerfrieden,de8df88b-9de8-4e0d-bbad-e058e412a9b8
6697869,Dianthus Calmfly White,"Dianthus Calmfly White is not exactly listed, but the competitor name specifies the variety ""Calmfly"". None of the candidates have ""Calmfly"" or a very close variant. The closest are various Dianthus varieties but with different cultivar names: Sweet White William, Lois Petit Raffine, Gypsy, Fen, Solomio.

Since the variety name is the strongest signal and none match ""Calmfly"", the correct answer is:

Null",Null
513560,Dianthus Gypsy Burgundy,Dianthus Gypsy Red,f2c09abf-69a5-45b4-abe7-6ea03d9caad5
942440,Dianthus Raffine Petit Aimee Light Pink,Dianthus Lois Petit Raffine White,2e311f6a-8c69-4142-89d5-c36c6932dbb4
8247058,Dianthus Solomio Blondfly Yellow,Ard Dianthus Solomio White,2c1e8cff-5e38-455c-9bf9-bed60f41c420
1562068,Dianthus Solomio Cas Light Pink,Cas Dianthus Pink Solomio,73bcc1a7-2e09-423d-ab4c-b439eebb6ad2
500194,Dianthus Solomio Fen Orange,Dianthus Fen Pink Solomio,4f4d3957-fa48-46ee-a98e-4a9bcb254662
500196,Dianthus Solomio Imre Hot Pink,Dianthus Imre Pink Solomio,6b033c32-432c-4386-93a5-d24881bafa91
4731976,Dianthus Solomio Pink,Cas Dianthus Pink Solomio,73bcc1a7-2e09-423d-ab4c-b439eebb6ad2
1912208,Dianthus Solomio Sem Purple Bicolor,Ard Dianthus Solomio White,2c1e8cff-5e38-455c-9bf9-bed60f41c420
817577,Dianthus Solomio White,Ard Dianthus Solomio White,2c1e8cff-5e38-455c-9bf9-bed60f41c420
490061,Dusty Miller Large Leaf Silver,Dusty Lacey Miller Silver,e47a4311-9e5e-4762-b94e-408ee36afcf3
490061,Dusty Miller Large Leaf Silver,Dusty Lacey Miller Silver,e47a4311-9e5e-4762-b94e-408ee36afcf3
490061,Dusty Miller Large Leaf Silver,Dusty Lacey Miller Silver,e47a4311-9e5e-4762-b94e-408ee36afcf3
490206,Dusty Miller Large Leaf Silver,Dusty Lacey Miller Silver,e47a4311-9e5e-4762-b94e-408ee36afcf3
490206,Dusty Miller Large Leaf Silver,Dusty Lacey Miller Silver,e47a4311-9e5e-4762-b94e-408ee36afcf3
569141,Eryngium Blue Bell Blue,Blue Eryngium Star Thistle,bc2c65d1-0e52-4421-bcee-283216d7a738
639533,Eryngium Magical Blue Lagoon Blue,Blue Lagoon Star Thistle Turquoise,124c70db-2f4d-4915-b473-028eaaa28907
11824116,Eryngium Magical White Lagoon White,Blue Eryngium Star Thistle,bc2c65d1-0e52-4421-bcee-283216d7a738
490291,Eucalyptus Baby Blue Blue,Baby Blue Eucalyptus Green,6f5d478f-b433-4da6-a445-ebc8502852f7
1714809,Eupatorium Assorted,Null,Null
515467,Eupatorium Pink,Null,Null
515467,Eupatorium Pink,Null,Null
515468,Eupatorium White,Null,Null
515486,Fern Sea Star Green,Null,Null
515492,Flexigrass Green,Null,Null
485045,Fuji Anastasia Bronze,Anastasia Roses White,df575412-0607-4cba-986b-13f851f38383
485047,Fuji Anastasia Green,Anastasia Roses White,df575412-0607-4cba-986b-13f851f38383
485050,Fuji Anastasia White,Anastasia Roses White,df575412-0607-4cba-986b-13f851f38383
485036,Fuji Assorted,Null,Null
485037,Fuji Bronze,Null,Null
485039,Fuji Green,Null,Null
490215,Fuji Hydra Pink,Null,Null
509380,Fuji Nexus Dark Purple,Nexus Orange Roses,f632e825-24f7-4c42-a237-e3cd831718d7
509379,Fuji Yazoo White,Null,Null
509425,Galax Green,Galax Green,044efdd7-cd26-4f8b-b111-8a7351ee7753
509425,Galax Green,Galax Green,044efdd7-cd26-4f8b-b111-8a7351ee7753
4726069,Garland Gypsophila Tinted Blue 10',Null,Null
4618509,Garland Gypsophila Tinted Blue 5',Null,Null
4726079,Garland Gypsophila Tinted Brown 10',Null,Null
4618516,Garland Gypsophila Tinted Brown 5',Null,Null
4726081,Garland Gypsophila Tinted Coffee Toffee Light Brown 10',Null,Null
4618526,Garland Gypsophila Tinted Coffee Toffee Light Brown 5',Null,Null
4726130,Garland Gypsophila Tinted Cold Sky Rainbow 10',Null,Null
4618540,Garland Gypsophila Tinted Cold Sky Rainbow 5',Null,Null
4726078,Garland Gypsophila Tinted Coral 10',Null,Null
4618515,Garland Gypsophila Tinted Coral 5',Null,Null
4726133,Garland Gypsophila Tinted Fashion Rainbow 10',Null,Null
4618544,Garland Gypsophila Tinted Fashion Rainbow 5',Null,Null
4726065,Garland Gypsophila Tinted Green 10',Null,Null
4618493,Garland Gypsophila Tinted Green 5',Null,Null
4726074,Garland Gypsophila Tinted Hot Pink 10',Null,Null
4618512,Garland Gypsophila Tinted Hot Pink 5',Null,Null
4726132,Garland Gypsophila Tinted Illusion Rainbow 10',Null,Null
4618543,Garland Gypsophila Tinted Illusion Rainbow 5',Null,Null
4726070,Garland Gypsophila Tinted Lavender 10',Null,Null
4618510,Garland Gypsophila Tinted Lavender 5',Null,Null
4726068,Garland Gypsophila Tinted Light Blue 10',Null,Null
4618508,Garland Gypsophila Tinted Light Blue 5',Null,Null
4726066,Garland Gypsophila Tinted Light Green 10',Null,Null
4618502,Garland Gypsophila Tinted Light Green 5',Null,Null
4726075,Garland Gypsophila Tinted Light Pink 10',Null,Null
4618513,Garland Gypsophila Tinted Light Pink 5',Null,Null
4726093,Garland Gypsophila Tinted Light Yellow 10',Null,Null
4618530,Garland Gypsophila Tinted Light Yellow 5',Null,Null
4726095,Garland Gypsophila Tinted Malima Rainbow 10',Null,Null
4618533,Garland Gypsophila Tinted Malima Rainbow 5',Null,Null
4726080,Garland Gypsophila Tinted New Pink Erika Pink 10',Null,Null
4618524,Garland Gypsophila Tinted New Pink Erika Pink 5',Null,Null
4726082,Garland Gypsophila Tinted Orange 10',Null,Null
4618527,Garland Gypsophila Tinted Orange 5',Null,Null
4726073,Garland Gypsophila Tinted Purple 10',Null,Null
4618511,Garland Gypsophila Tinted Purple 5',Null,Null
4726077,Garland Gypsophila Tinted Red 10',Null,Null
4618514,Garland Gypsophila Tinted Red 5',Null,Null
4726128,Garland Gypsophila Tinted Sunrise Rainbow 10',Null,Null
4618539,Garland Gypsophila Tinted Sunrise Rainbow 5',Null,Null
4726131,Garland Gypsophila Tinted Sunset Rainbow 10',Null,Null
4618541,Garland Gypsophila Tinted Sunset Rainbow 5',Garden Orange Roses Sunset,e465d3d2-a6ca-4666-bd9a-8648a1b1a25d
4726126,Garland Gypsophila Tinted Sweet Candy Pink Mix 10',Null,Null
4618538,Garland Gypsophila Tinted Sweet Candy Pink Mix 5',Null,Null
4726067,Garland Gypsophila Tinted Turquoise 10',Null,Null
4618507,Garland Gypsophila Tinted Turquoise 5',Null,Null
4726083,Garland Gypsophila Tinted Yellow 10',Null,Null
4618529,Garland Gypsophila Tinted Yellow 5',Null,Null
4726064,Garland Gypsophila Xlence Natural White 10',Null,Null
4618479,Garland Gypsophila Xlence Natural White 5',Null,Null
513625,Gerbera Black Center Assorted,Null,Null
513641,Gerbera Black Center Hot Pink,Null,Null
513651,Gerbera Black Center Orange,Null,Null
513655,Gerbera Black Center Pink,Null,Null
513657,Gerbera Black Center Red,Null,Null
513788,Gerbera Green Center Yellow,Null,Null
2665240,Grass Pampas Beige Tall,Null,Null
1198724,Green Mist Chocolate Brown,Null,Null
515858,Green Mist Green,Null,Null
515858,Green Mist Green,Null,Null
1034329,Gypsophila Cosmic White,Null,Null
485064,Gypsophila Million Star White,Null,Null
485064,Gypsophila Million Star White,Null,Null
485064,Gypsophila Million Star White,Null,Null
485065,Gypsophila Mirabella White,Null,Null
485066,Gypsophila New Love White,Null,Null
485069,Gypsophila Xlence White,Null,Null
485069,Gypsophila Xlence White,Null,Null
485069,Gypsophila Xlence White,Null,Null
515911,Honey Bracelet Green,Bracelet Green Honey Myrtle,b5aeabaa-49a1-4281-83f9-0d96083b038e
1756473,Hydrangea 50/50 Mix White/Light Blue,Null,Null
1055325,Hydrangea Antique Assorted,Antique Hydrangea Select Super White,ebb123e8-4b9c-417a-972e-c2f266e3828c
1050373,Hydrangea Antique Assorted Large,Antique Hydrangea Select Super White,ebb123e8-4b9c-417a-972e-c2f266e3828c
520130,Hydrangea Antique Blue/Green Jumbo,/ Antique Blue Exclusive Grown Hydrangea Select,4d65a9df-e544-4efc-8523-98196735e2b4
485124,Hydrangea Antique Blue/Green Large,/ Antique Blue Exclusive Grown Hydrangea Select,4d65a9df-e544-4efc-8523-98196735e2b4
485132,Hydrangea Antique Green Large,Antique Green Hydrangea Select,dd4ac3b2-1d61-46bb-a57c-b6ad09bd3fb5
485133,Hydrangea Antique Green Medium,Antique Green Hydrangea Select,dd4ac3b2-1d61-46bb-a57c-b6ad09bd3fb5
646798,Hydrangea Antique Hulk Green/Blue Large,Antique Green Hydrangea Select,dd4ac3b2-1d61-46bb-a57c-b6ad09bd3fb5
646798,Hydrangea Antique Hulk Green/Blue Large,Antique Green Hydrangea Select,dd4ac3b2-1d61-46bb-a57c-b6ad09bd3fb5
865842,Hydrangea Antique Red/Green Jumbo,/ Antique Exclusive Green Grown Hydrangea Jumbo,3fa6869a-a196-4539-9744-05fdbcbf7f23
